,Question,Answer,Label
10312,what is a store confectioner,"A confectionery store (more commonly referred to as a sweet shop in the United Kingdom, a candy store in the North America, or a lolly shop in Australia) sells confectionery and is usually targeted to children.",1
10313,what is a store confectioner,Most confectionery stores are filled with an assortment of sweets far larger than a grocer or convenience store could accommodate.,1
10332,what are tires made of,"The materials of modern pneumatic tires are synthetic rubber , natural rubber , fabric and wire, along with carbon black and other chemical compounds.",1
10344,who killed general warren in bunker hill,"Rather than exercising his rank, Warren served in the battle as a private soldier, and was killed in combat when British troops stormed the redoubt atop Breed's Hill .",1
10366,where do women ejeculation exactly coming from,Female ejaculation is the expulsion of fluid by human females from the paraurethral ducts through and around the female urethra during or before an orgasm .,1
10371,who won the women's world cup,Japan won the 2011 tournament in a penalty shootout.,1
10411,who owns smirnoff,Smirnoff is a brand of vodka owned and produced by the British company Diageo .,1
10421,who wrote serenity prayer,The Serenity Prayer is the common name for an originally untitled prayer by the American theologian Reinhold Niebuhr (1892–1971).,1
10426,what are the Declaration and Resolves of the First Continental Congress about,"The Declaration and Resolves of the First Continental Congress (also known as the Declaration of Colonial Rights, or the Declaration of Rights), was a statement adopted by the First Continental Congress on October 14, 1774, in response to the Intolerable Acts passed by the British Parliament .",1
10427,what are the Declaration and Resolves of the First Continental Congress about,"The Declaration outlined colonial objections to the Intolerable Acts, listed a colonial bill of rights , and provided a detailed list of grievances.",1
10428,what are the Declaration and Resolves of the First Continental Congress about,"It was similar to the Declaration of Rights and Grievances , passed by the Stamp Act Congress a decade earlier.",1
10441,what is a bad beat in poker,"In poker , bad beat is a subjective term for a hand in which a player with what appear to be strong cards nevertheless loses.",1
10454,what part of beef are rouladen cut from?,The cut is usually topside beef or silverside since this is the cheaper cut.,1
10462,where does cellular respiration occur,"Cellular respiration is the set of the metabolic reactions and processes that take place in the cells of organisms to convert biochemical energy from nutrients into adenosine triphosphate (ATP), and then release waste products.",1
10490,what is a lapping machine,"Lapping is a machining process, in which two surfaces are rubbed together with an abrasive between them, by hand movement or by way of a machine.",1
10507,who plays ethan in my babysitter's a vampire,"The show follows Ethan Morgan ( Matthew Knight ), who, in the television film, learns that his babysitter Sarah ( Vanessa Morgan ) is a vampire .",1
10572,what is a base SI unit,"The seven SI base units and the interdependency of their definitions: for example, to extract the definition of the metre from the speed of light , the definition of the second must be known while the ampere and candela are both dependent on the definition of energy which in turn is defined in terms of length , mass and time .",1
10601,what state is area code 419,North American telephone area codes 419 and 567 serve the northwest quadrant of the U.S. state of Ohio .,1
10612,what is 9/11 bombings,"The September 11 attacks (also referred to as September 11, September 11th, or 9/11) were a series of four coordinated terrorist attacks launched by the Islamic terrorist group al-Qaeda upon the United States in New York City and the Washington, D.C. area on September 11, 2001.",1
10650,what are social security taxes,"Tax deposits are formally entrusted to the Federal Old-Age and Survivors Insurance Trust Fund, the Federal Disability Insurance Trust Fund, the Federal Hospital Insurance Trust Fund, or the Federal Supplementary Medical Insurance Trust Fund which comprise the Social Security Trust Fund .",1
10659,what town is laurel hollow ny in,"Laurel Hollow is a village in the Town of Oyster Bay in Nassau County, New York in the United States .",1
10661,when did charles dickens live,Charles John Huffam Dickens (; 7 February 1812 – 9 June 1870) was an English writer and social critic.,1
10682,when did the civil rights movement begin,The civil rights movement was a series of worldwide political movements for equality before the law that peaked in the 1960s.,1
10695,who won fifa world cup 2010,"In the final, Spain , the European champions , defeated third-time finalists the Netherlands 1–0 after extra time , with Andrés Iniesta 's goal in the 116th minute giving Spain their first world title, becoming the eighth nation to win the tournament, and the first European nation to win the tournament outside its home continent.",1
10700,when did egg mcmuffin get invented,The Egg McMuffin is the signature breakfast sandwich; it was invented by the late McDonald's franchisee Herb Peterson in the late 1960s and was introduced nationwide in 1972.,1
10702,who shot john lennon?,"He was shot by Mark David Chapman at the entrance of the building where he lived, The Dakota , in New York City on 8 December 1980.",1
10708,what state is new orleans in,"New Orleans ( or , locally or ; ) is a major United States port and the largest city and metropolitan area in the state of Louisiana .",1
10724,what where the most important factors that led to the defeat of the democrates in 1968?,"It was a wrenching national experience, conducted during a year of violence that included the assassination of civil rights leader Martin Luther King, Jr. , and subsequent race riots across the nation, the assasination of Democratic presidential candidate Robert F. Kennedy , widespread opposition to the Vietnam War across university campuses, and violent confrontations between police and anti-war protesters at the 1968 Democratic National Convention as the Democratic party split again and again.",1
10741,when did kurt cobain kill himself,"On April 8, 1994, Cobain was found dead at his home in Seattle , the victim of what was officially ruled a suicide by a self-inflicted shotgun wound to the head.",1
10744,what is a millwright worker,A millwright is a craftsman or tradesman engaged with the construction and maintenance of machinery .,1
10779,what the names of destiny's child,"Destiny's Child was an American R&B girl group whose final, and perhaps most recognizable, line-up comprised Beyoncé Knowles , Kelly Rowland and Michelle Williams .",1
10817,who created the tourbillon movement?,"Developed around 1795 by the French-Swiss watchmaker Abraham-Louis Breguet from an earlier idea by the English chronometer maker John Arnold , a tourbillon aims to counter the effects of gravity by mounting the escapement and balance wheel in a rotating cage, to negate the effect of gravity when the timepiece (thus the escapement) is stuck in a certain position.",1
10820,what is an .msi file,"The Windows Installer (previously known as Microsoft Installer) is a software component used for the installation, maintenance, and removal of software on modern Microsoft Windows systems.",1
10828,what is a Four Lokos,"Four Loko is a line of alcoholic beverages , originally marketed as energy drinks , sold by Phusion Projects of Chicago, Illinois .",1
10836,what is a fret on a guitar,A fret is a raised element on the neck of a stringed instrument .,1
10931,what is an agents job role in film,"A talent agent, or booking agent, is a person who finds jobs for actors , authors , film directors , musicians , models , producers, professional athletes , writers and other people in various entertainment businesses.",1
10932,what is an agents job role in film,"An agent also defends, supports and promotes the interest of his/her clients.",1
10948,"who discovered the 2 moons of mars,Phobos and Deimos","Both satellites were discovered in 1877 by Asaph Hall and are named after the characters Phobos (panic/fear) and Deimos (terror/dread) who, in Greek mythology , accompanied their father Ares , god of war, into battle.",1
10951,WHAT IS A LAW ENFORCEMENT MURDER BOOK,"In law enforcement parlance, the term murder book refers to the case file of a murder investigation.",1
11010,when album love always released,"Love Always is the debut album of American R&B duo K-Ci & JoJo , released on June 17, 1997, by MCA Records .",1
11036,who killed robert kennedy,"Sirhan Sirhan , a 24-year-old Palestinian / Jordanian immigrant , was convicted of Kennedy's murder and is serving a life sentence for the crime.",1
11051,when Harry met Sally case,"The film raises the question ""Can men and women ever just be friends?"" and advances many ideas about relationships that became household concepts, such as those of the """" girlfriend and the ""transitional person"".",1
11068,who owns hamburger helper,It is made by General Mills .,1
11079,what makes a dwarf planet,A dwarf planet is a planetary-mass object that is neither a planet nor a satellite .,1
11080,what makes a dwarf planet,"More explicitly, the International Astronomical Union (IAU) defines a dwarf planet as a celestial body in direct orbit of the Sun that is massive enough for its shape to be controlled by gravitation , but that unlike a planet has not cleared its orbital region of other objects.",1
11105,when did jack lalanne die,"Francois Henri ""Jack"" LaLanne (September 26, 1914 - January 23, 2011) was an American fitness , exercise , and nutritional expert and motivational speaker who is sometimes called ""the godfather of fitness"" and the ""first fitness superhero.""",1
11140,who made the original care bears,The Care Bears are characters created by American Greetings in 1981 for use on greeting cards .,1
11158,what states does interstate 70 travel through,"Interstate 70 (I-70) is an Interstate Highway in the United States that runs from Interstate 15 near Cove Fort, Utah , to a Park and Ride near Baltimore, Maryland .",1
11168,when do solar eclipses happen?,"As seen from the Earth , a solar eclipse occurs when the Moon passes between the Sun and Earth, and the Moon fully or partially blocks ("" occults "") the Sun.",1
11188,where do mangos come from,"The mango is native to South Asia , from where it has been distributed worldwide to become one of the most cultivated fruits in the tropics .",1
11199,what latitude is tropic of cancer,It currently (Year 2013) lies at 23° 26′ 15.143′′ north of the Equator.,1
11204,what video format will play in a DVD player,"Discs using the DVD-Video specification require a DVD drive and an H.262/MPEG-2 Part 2 decoder (e.g., a DVD player, or a computer DVD drive with a software DVD player).",1
11217,what part of the government governs the US post office?,"The United States Postal Service (USPS), also known as the Post Office and U.S. Mail, is an independent agency of the United States federal government responsible for providing postal service in the United States.",1
11227,what state is the capital in,"Washington, D.C. has been the capital of the United States since 1800.",1
11232,what are square diamonds called?,The face-up shape of the princess cut is square or rectangular and the profile or side-on shape is similar to that of an inverted pyramid with four beveled sides.,1
11255,what is a dogs classification,"The domestic dog (Canis lupus familiaris) is a subspecies of the gray wolf (Canis lupus), a member of the Canidae family of the mammalian order Carnivora .",1
11280,who owns popeyes chicken,"Often referred to as Popeyes and sometimes as Popeyes Chicken & Biscuits or Popeyes Chicken & Seafood, It was acquired by Sandy Springs, Georgia -based AFC Enterprises , originally America's Favorite Chicken Company, in 1993.",1
11294,what nationality is wendy williams,"Wendy Williams Hunter (born Wendy Joan Williams; July 18, 1964) is an American media personality , actress and author.",1
11300,who said give me liberty or give me death,"Patrick Henry ""Treason"" speech before the House of Burgesses in an 1851 painting by Peter F. Rothermel",1
11301,who said give me liberty or give me death,"Give me liberty, or give me death! is a quotation attributed to Patrick Henry from a speech he made to the Virginia Convention .",1
11317,what president was theodore roosevelt,"Roosevelt, Jr. ( ; October 27, 1858—January 6, 1919) was the 26th President of the United States (1901–1909).",1
11352,who starred in webster,"The show stars Emmanuel Lewis in the title role as a young boy who, after losing his parents, is adopted by his NFL -pro godfather, portrayed by Alex Karras , and his new socialite wife, played by Susan Clark .",1
11422,what is adem disease,Acute disseminated encephalomyelitis (ADEM) is an immune mediated disease of the brain .,1
11423,what is adem disease,"It usually occurs following a viral infection but may appear following vaccination , bacterial or parasitic infection, or even appear spontaneously.",1
11455,who created bing,"Bing (known previously as Live Search, Windows Live Search, and MSN Search) is a web search engine (advertised as a "" decision engine "") from Microsoft .",1
11496,who made hubble telescope,"The HST was built by the United States space agency NASA , with contributions from the European Space Agency , and is operated by the Space Telescope Science Institute .",1
11507,what are anti inflammatories,Anti-inflammatory refers to the property of a substance or treatment that reduces inflammation .,1
11518,when did andrea doria sink,"Pronounced was an ocean liner for the Italian Line (Società di navigazione Italia) home ported in Genoa , Italy, most famous for its sinking in 1956, when 52 people died (51 from immediate impact).",1
11536,what are dialysis tubes,Dialysis tubing is a type of semi- or partially permeable membrane tubing made from regenerated cellulose or cellophane .,1
11640,what are four thirds cameras,The Four Thirds system is a standard created by Olympus and Kodak for digital single-lens reflex camera (DSLR) design and development.<ref name='DPReview.com 2001-02-13'>,1
11682,who wrote  nature boy,"Nature Boy is a song by Eden Ahbez , published in 1947.",1
11721,when did playstation 3 first launch,The launch of the PlayStation 3 into the Japanese market on 10 November 2006 marked the second major seventh generation entertainment system to be released.,1
11751,where does ground pepper come from,"Black pepper (Piper nigrum) is a flowering vine in the family Piperaceae , cultivated for its fruit , which is usually dried and used as a spice and seasoning .",1
11754,where does ground pepper come from,"Black pepper is native to south India , and is extensively cultivated there and elsewhere in tropical regions.",1
11755,where does ground pepper come from,"Currently Vietnam is the world's largest producer and exporter of pepper, producing 34% of the world's Piper nigrum crop as of 2008.",1
11802,who wrote the song cocaine,"Cocaine is a song written and recorded by JJ Cale in 1976, but also known as a cover version recorded by Eric Clapton .",1
11807,when did pearl harbor get bombed,"The attack on Pearl Harbor (called Hawaii Operation or Operation AI by the Japanese Imperial General Headquarters (Operation Z in planning) and the Battle of Pearl Harbor) was a surprise military strike conducted by the Imperial Japanese Navy against the United States naval base at Pearl Harbor , Hawaii, on the morning of December 7, 1941 (December 8 in Japan).",1
11829,who won season 2 of project runway,"The winning designer, Chloe Dao , received $100,000 in seed money to help launch her own line, a 2007 Saturn Sky roadster, a spread in ELLE magazine, and a mentorship with the Banana Republic Design Team.",1
11837,what is a mule in coins,"In numismatics , a mule is a coin or medal minted with obverse and reverse designs not normally seen on the same piece.",1
11866,who plays mary poppins in the movie,"Mary Poppins is a 1964 musical film starring Julie Andrews , Dick Van Dyke , David Tomlinson , and Glynis Johns , produced by Walt Disney , and based on the Mary Poppins books series by P. L. Travers .",1
11870,what is an arc in a story plot,"A story arc is an extended or continuing storyline in episodic storytelling media such as television , comic books , comic strips , boardgames , video games , and in some cases, films .",1
11877,when does black friday start for christmas,"Black Friday is the day following Thanksgiving Day in the United States , often regarded as the beginning of the Christmas shopping season.",1
11885,when does black friday start for christmas,"This was taken to a new extreme in 2011, when several retailers (including Target , Kohl's , Macy's , Best Buy , and Bealls ) opened at midnight for the first time.",1
11886,when does black friday start for christmas,"In 2012, Walmart and several other retailers announced that they would open most of their stores at 8:00 p.m. on Thanksgiving Day (except in states where opening on Thanksgiving is prohibited due to blue laws , such as Massachusetts where they still opened around midnight), prompting calls for a walkout among some workers.",1
11908,who sang what a wonderful world,It was first recorded by Louis Armstrong and released as a single in 1967.,1
11915,what month is the president inaugurated,"The day a presidential inauguration occurs is known as ""Inauguration Day"" and occurs on January 20 (or 21st if the 20th is a Sunday).",1
11956,what movement was elizabeth cady stanton a part of,"Elizabeth Cady Stanton (November 12, 1815 – October 26, 1902) was an American social activist , abolitionist, and leading figure of the early women's rights movement .",1
11957,what movement was elizabeth cady stanton a part of,"Her Declaration of Sentiments , presented at the first women's rights convention held in 1848 in Seneca Falls , New York , is often credited with initiating the first organized women's rights and women's suffrage movements in the United States.",1
11973,what radio station are the boston bruins on?,"The Boston Bruins Radio Network is a 25-station (17 A.M., 8 F.M. plus 2 F.M. translators) CBS Radio network which carries live game broadcasts of the Boston Bruins .",1
11974,what radio station are the boston bruins on?,"The network's flagship station is WBZ-FM /98.5- Boston, Massachusetts .",1
11985,what are the characteristics of an ethnic group,Ethnicity or ethnic group is a socially defined category based on common culture or nationality .,1
11986,what are the characteristics of an ethnic group,"Ethnicity can, but does not have to, include common ancestry , appearance , cuisine , dressing style, heritage , history , language or dialect , religion , symbols , traditions , or other cultural factor.",1
11987,what are the characteristics of an ethnic group,Ethnic identity is constantly reinforced through common characteristics which set the group apart from other groups.,1
12016,what are add ons,"Plug-in (computing) , a piece of software which enhances another software application and usually cannot be run independently",1
12017,what are add ons,"Browser extension , which modifies the interface and/or behavior of web browsers",1
12018,what are add ons,"Add-on (Mozilla) , a piece of software that enhances and customizes Mozilla-based applications",1
12019,what are add ons,"Add-ons for Firefox (addons.mozilla.org), the official Mozilla Foundation web site which serves as a repository of add-ons for Mozilla-based applications",1
12020,what are add ons,"Peripheral , an optional computer hardware component that significantly supplements or enhances the functionality of the original unit",1
12021,what are add ons,"Video game accessory , a piece of hardware used in conjunction with a video game console for playing video games",1
12024,what are club seats,"They are usually right next to the Luxury Boxes , either right above, right below, or sandwiched between two levels of Luxury Boxes.",1
12025,what are club seats,"Club Level seating is considered as higher class than sitting anywhere else in the arena, but lower class compared to the Luxury Boxes.",1
12050,what school did oprah winfrey help,"The Oprah Winfrey Leadership Academy for Girls - South Africa is a female boarding school founded in January 2007 and located in Henley on Klip near Meyerton , south of Johannesburg , South Africa .",1
12071,what structure is disulfide bonds,"In chemistry , a disulfide bond (Br.E. disulphide bond) is a covalent bond , usually derived by the coupling of two thiol groups .",1
12088,what is a redshirt freshman football player,"In United States college athletics , redshirt is a delay or suspension of an athlete's participation in order to lengthen his or her period of eligibility.",1
12126,who rules communism government,It has a form of government characterized by single-party rule or dominant-party rule of a communist party (referred as Dictatorship of the Proletariat by its proponents) and a professed allegiance to a Leninist or Marxist–Leninist ideology as the guiding principle of the state.,1
12237,what year did South Africa become a team in rugby,"The side has been playing international rugby since 1891, when a British Isles side toured the nation, playing South Africa in their first Test on 30 July.",1
12262,what is a discipline of study,"An academic discipline, or field of study, is a branch of knowledge that is taught and researched at the college or university level.",1
12263,what is a discipline of study,"Disciplines are defined (in part), and recognized by the academic journals in which research is published, and the learned societies and academic departments or faculties to which their practitioners belong.",1
12278,who did john f kennedy run against?,Kennedy defeated Vice President and Republican candidate Richard Nixon in the 1960 U.S. presidential election .,1
12295,who wrote stand by me,"Stand by Me is a song originally performed by Ben E. King and written by King, Jerry Leiber , and Mike Stoller , inspired by the spiritual ""Lord Stand by Me,"" plus two lines rooted in Psalms 46:2–3.",1
12298,what are metaphors used for,"A metaphor is a figure of speech that describes a subject by asserting that it is, on some point of comparison, the same as another otherwise unrelated object.",1
12299,what are metaphors used for,"Metaphor is a type of analogy and is closely related to other rhetorical figures of speech that achieve their effects via association, comparison or resemblance including allegory , hyperbole , and simile .",1
12327,what are the names of the ll divos,"Il Divo is a group of four male singers: French pop singer Sébastien Izambard , Spanish baritone Carlos Marín , American tenor David Miller , and Swiss tenor Urs Bühler .",1
12337,where did the vietnamese settle in america,"More than sixty percent of Vietnamese Americans reside in the states of California , Texas , Washington , Florida , and Virginia .",1
12339,when did hitler kill himself,Adolf Hitler committed suicide by gunshot on 30 April 1945 in his Führerbunker in Berlin.,1
12361,when did world war 2 end,"World War II (WWII or WW2), also known as the Second World War, was a global war that lasted from 1939 to 1945.",1
12387,what is a llc company?,A limited liability company (LLC) is a flexible form of enterprise that blends elements of partnership and corporate structures.,1
12389,what is a llc company?,An LLC is a legal form of company that provides limited liability to its owners in the vast majority of United States jurisdictions.,1
12394,what are k cups,"K-Cup portion packs are used with Keurig or other single cup brewing systems to brew a cup of coffee , tea , or hot chocolate .",1
12405,what is a chronograph watch,A chronograph is a specific type of watch that is used as a stopwatch combined with a display watch.,1
12408,what is a PCI port used for,"Conventional PCI (PCI is an initialism formed from Peripheral Component Interconnect, part of the PCI Local Bus standard and often shortened to just PCI) is a local computer bus for attaching hardware devices in a computer .",1
12437,who invented the television,"The earliest proposal was in 1908, in a paper by A. A. Campbell-Swinton and postulated the use of cathode rays.",1
12455,what are the side effects for lyme disease,"Early symptoms may include fever , headache , fatigue , depression , and a characteristic circular skin rash called erythema migrans (EM).",1
12456,what are the side effects for lyme disease,"Left untreated, later symptoms may involve the joints, heart, and central nervous system .",1
12465,what are a and r reps,Artists and repertoire (A&R) is the division of a record label or music publishing company that is responsible for talent scouting and overseeing the artistic development of recording artists and/or songwriters.,1
12467,what measurement is a furlong,"A furlong is a measure of distance in imperial units and U.S. customary units equal to one-eighth of a mile , equivalent to 220 yards , 660 feet , 40 rods , or 10 chains .",1
12480,where does ray lamontagne live,He lives in Massachusetts with his wife and two children.,1
12481,when the wind blows james patterson,When the Wind Blows is a novel by James Patterson .,1
12489,who made facebook,"It was founded in February 2004 by Mark Zuckerberg with his college roommates and fellow Harvard University students Eduardo Saverin , Andrew McCollum , Dustin Moskovitz and Chris Hughes .",1
