,Question,Answer,Label
14615,Who is General Grievous of Star Wars,"A recurring antagonist, he is the Supreme Commander of the Confederacy of Independent Systems, a political faction of planetary systems waging war on the Galactic Republic .",1
14640,what is an irregular heartbeat pvc,"A premature ventricular contraction (PVC), also known as a premature ventricular complex, ventricular premature contraction (or complex or complexes) (VPC), ventricular premature beat (VPB), or ventricular extrasystole (VES), is a relatively common event where the heartbeat is initiated by Purkinje fibres in the ventricles rather than by the sinoatrial node , the normal heartbeat initiator.",1
14644,what is an irregular heartbeat pvc,"In a PVC, the ventricles contract first and before the atria have optimally filled the ventricles with blood, which means that circulation is inefficient.",1
14685,what is flour made from,"Flour is a powder which is made by grinding cereal grains , or other seeds or roots (like Cassava ).",1
14691,what is my resting heart rate at age 24,"Heart rate can vary as the body's need to absorb oxygen and excrete carbon dioxide changes, such as during physical exercise , sleep , illness, or as a result of ingesting drugs :",1
14702,what is the name for an old horse-drawn vehicle,"A carriage is a wheeled vehicle for people, usually horse-drawn; litters (palanquins) and sedan chairs are excluded, since they are wheelless vehicles.",1
14708,where was the tsunami in 2005,"The 2004 Indian Ocean earthquake was an undersea megathrust earthquake that occurred at 00:58:53 UTC on Sunday, 26 December 2004, with an epicentre off the west coast of Sumatra , Indonesia.",1
14723,what is the source of geothermal energy,The Geothermal energy of the Earth's crust originates from the original formation of the planet (20%) and from radioactive decay of minerals (80%).,1
14743,what is cubic ft,"The term cubic foot is an Imperial and US customary (non- metric ) unit of volume , used in the United States and the United Kingdom.",1
14747,who was ho chi minh in vietnam war,"He was a key figure in the foundation of the Democratic Republic of Vietnam in 1945, as well as the People’s Army of Vietnam (PAVN) and the Việt Cộng (NLF or VC) during the Vietnam War .",1
14777,what is another name for cpu,"A central processing unit (CPU), also referred to as a central processor unit, is the hardware within a computer that carries out the instructions of a computer program by performing the basic arithmetical, logical, and input/output operations of the system.",1
14839,who was charged with murder after the massacre at My lai,"While 26 U.S. soldiers were initially charged with criminal offenses for their actions at Mỹ Lai, only Second Lieutenant William Calley , a platoon leader in Charlie Company, was convicted.",1
14894,what is metal music about,"With roots in blues rock and psychedelic rock , the bands that created heavy metal developed a thick, massive sound, characterized by highly amplified distortion , extended guitar solos, emphatic beats, and overall loudness.",1
14895,what is metal music about,Heavy metal lyrics and performance styles are generally associated with masculinity and machismo .,1
14903,what is extreme right wing,The far-right (also known as the extreme right) refers to the highest degree of rightism in right-wing politics .,1
14904,what is extreme right wing,"Far right politics involves support of strong or complete social hierarchy in society, and supports supremacy of certain individuals or groups deemed to be innately superior or preferable who are to be more valued than those deemed to be innately inferior or undesirable.",1
14912,what is the title of Hobbes main work,His 1651 book Leviathan established the foundation for most of Western political philosophy from the perspective of social contract theory.,1
14917,what is high emotional intelligence?,"Emotional intelligence (EI) is the ability to identify, assess, and control the emotions of oneself, of others, and of groups.",1
14921,what is the role of heredity,Heredity is the passing of traits to offspring from its parents or ancestor.,1
14922,what is the role of heredity,This is the process by which an offspring cell or organism acquires or becomes predisposed to the characteristics of its parent cell or organism.,1
14939,what is prefix phone number,"A telephone prefix is the first set of digits of a telephone number; in the North American Numbering Plan countries (country code 1), it is the first three digits of a seven-digit phone number.",1
14945,what is metformin used for,"Metformin ( BP , pronounced , ; originally sold as Glucophage) is an oral antidiabetic drug in the biguanide class.",1
14946,what is metformin used for,"It is the first-line drug of choice for the treatment of type 2 diabetes , in particular, in overweight and obese people and those with normal kidney function.",1
14959,what is it like at mount rushmore?,"The Mount Rushmore National Memorial is a sculpture carved into the granite face of Mount Rushmore near Keystone , South Dakota , in the United States .",1
14979,what is buttoned-down shirt?,"The term ""button-down"" (which refers a type of shirt which has a collar fastened down by buttons) is sometimes used in error to apply to all shirts (with or without buttoned down collars), being used as a synonym for ""button-up"" or ""button-front"".",1
14981,when is administrative assistant day,"In North America , it is celebrated on the Wednesday of the last full week of April (April 24 in 2013).",1
14993,where is keith whitley from,"Jackie Keith Whitley (July 1, 1954Stambler, Irwin, and Grelun Landon (2000). - Country Music: The Encyclopedia. - New York: St. Martin's Press. - p.533. - ISBN 978-0-312-26487-1.—Carlin, Richard (2003). - Country Music: A Biographical Dictionary. - New York: Routledge - p.427. - ISBN 978-0-415-93802-0.—Larkin, Colin (1995). - The Guinness Encyclopedia of Popular Music. - New York: Stockton Press - P.4462. - ISBN 978-0-85112-662-3.—Stanton, Scott (2003). - The Tombstone Tourist: Musicians. - New York: Pocket Books. - p.395. - ISBN 978-0-7434-6330-0.—Hicks, Jack. - ""Singer Keith Whitley's Memory Alive Through Songs, Love in Home Town"". - The Kentucky Post . - September 25, 1991.—""Country Music Star Keith Whitley Dead at 33"". - Lexington Herald-Leader . - May 10, 1989.——Hurst, Jack. - ""Whitley's Last Days"". - Chicago Tribune . - May 14, 1989.—""Alcohol Kills Country Singer Keith Whitley"". - United Press International . - (c/o The San Francisco Chronicle ). - May 10, 1989. — May 9, 1989), known professionally as Keith Whitley, was an American country music singer.",1
15015,where are the internal and external iliac arteries,The external iliac arteries are two major arteries which bifurcate off the common iliac arteries anterior to the sacroiliac joint of the pelvis.,1
15019,what is steam by valve corporation,"Steam is a digital distribution , digital rights management , multiplayer and communications platform developed by Valve Corporation .",1
15037,where is the Rhine river located on a map,"The Rhine (; ; ) is a European river that runs from the Swiss canton of Grisons in the southeastern Swiss Alps through Germany and eventually flows into the North Sea coast in the Netherlands and is the twelfth longest river in Europe , at about , with an average discharge of more than .",1
15043,what is sanskrit shri,"Sri ( Devanagari : श्री, IAST ; Śrī), also transliterated as Sree or Shri or Shree is a word of Sanskrit origin, used in the Indian subcontinent as polite form of address equivalent to the English ""Mr."" in written and spoken language, or as a title of veneration for deities (usually translated as ""Holy"").",1
15045,what is civil engineering aBOUT,"Civil engineering is a professional engineering discipline that deals with the design, construction, and maintenance of the physical and naturally built environment, including works like roads, bridges, canals , dams, and buildings.",1
15096,Where is South Beach in Miami,"South Beach, also nicknamed SoBe, is a neighborhood in the city of Miami Beach , Florida , United States , located due east of Miami city proper between Biscayne Bay and the Atlantic Ocean .",1
15102,who was john f kennedy up against,"The Republican Party nominated incumbent Vice-President Richard Nixon , while the Democratic Party nominated John F. Kennedy , Senator from Massachusetts.",1
15145,what is the controlled substance act known as,The Controlled Substances Act (CSA) was enacted into law by the Congress of the United States as Title II of the Comprehensive Drug Abuse Prevention and Control Act of 1970 .,1
15182,when was fdr elected as president,"Franklin Delano Roosevelt ( or ; January 30, 1882 – April 12, 1945), also known by his initials, FDR, was the 32nd President of the United States (1933–1945) and a central figure in world events during the mid-20th century, leading the United States during a time of worldwide economic depression and total war.",1
15206,where was ms-13 originally from,"Mara Salvatrucha (commonly abbreviated as MS, Mara, and MS-13) is a transnational criminal gang that originated in Los Angeles and has spread to other parts of the United States, Canada, Mexico, and Central America.",1
15215,what is bones job,"The show is based on forensic anthropology and forensic archaeology , with each episode focusing on an FBI case file concerning the mystery behind human remains brought by FBI Special Agent Seeley Booth ( David Boreanaz ) to the forensic anthropologist Dr. Temperance ""Bones"" Brennan ( Emily Deschanel ).",1
15225,where was the super bowl in 1991,"The game was held at Tampa Stadium in Tampa, Florida , on January 27, 1991, during the height of the Gulf War .",1
15236,when was malcolm x assassinated,"Malcolm X (; May 19, 1925February 21, 1965), born Malcolm Little and also known as El-Hajj Malik El-Shabazz (), was an African-American Muslim minister and human rights activist.",1
15246,when was malcolm x assassinated,"In February 1965, less than a year after leaving the Nation of Islam, he was assassinated by three members of the group.",1
15258,who are the characters in 90210 in season 3,"Regular cast members for the season included Shenae Grimes , Tristan Wilds , AnnaLynne McCord , Ryan Eggold , Jessica Stroup , Michael Steger , Jessica Lowndes , Matt Lanter , Gillian Zinser , Trevor Donovan and Lori Loughlin .",1
15275,when was queen elizabeth ii married,"In 1947, she married Prince Philip, Duke of Edinburgh , with whom she has four children: Charles , Anne , Andrew , and Edward .",1
15307,where are facial sinuses,"Paranasal sinuses are a group of four paired air-filled spaces that surround the nasal cavity ( maxillary sinuses ), above the eyes ( frontal sinuses ), between the eyes ( ethmoid sinuses ), and behind the ethmoids ( sphenoid sinuses ).",1
15309,what is lean manufacturing and who developed,"Lean manufacturing, lean enterprise, or lean production, often simply, ""Lean,"" is a production practice that considers the expenditure of resources for any goal other than the creation of value for the end customer to be wasteful, and thus a target for elimination.",1
15312,what is lean manufacturing and who developed,"Lean manufacturing is a management philosophy derived mostly from the Toyota Production System (TPS) (hence the term Toyotism is also prevalent) and identified as ""Lean"" only in the 1990s.",1
15329,who is is the singer westlife,Westlife were an Irish boy band which formed in 1998 and disbanded in 2012.,1
15342,what is vitamin a for,"Vitamin A has multiple functions, it is important for growth and development, for the maintenance of the immune system and good vision.",1
15343,what is vitamin a for,"Vitamin A is needed by the retina of the eye in the form of retinal , which combines with protein opsin to form rhodopsin the light-absorbing molecule , that is necessary for both low-light ( scotopic vision) and color vision .",1
15371,what is the capital city of california.,Sacramento is the capital city of the U.S. state of California and the seat of government of Sacramento County .,1
15386,when is it memorial day,Memorial Day is a United States federal holiday which occurs every year on the final Monday of May.,1
15402,"What was ""Freedom Summer""?","Freedom Summer (also known as the Mississippi Summer Project) was a campaign in the United States launched in June 1964 to attempt to register as many African American voters as possible in Mississippi , which had historically excluded most blacks from voting.",1
15403,"What was ""Freedom Summer""?","The project also set up dozens of Freedom Schools, Freedom Houses, and community centers in small towns throughout Mississippi to aid the local black population.",1
15422,where is dia de los muertos celebrated,Day of the Dead () is a Mexican holiday celebrated throughout Mexico and around the world in other cultures.,1
15433,what was the Name the first electronic handheld calculator,The ANITA Mark VII and ANITA Mark VIII calculators were launched simultaneously in late 1961 as the world's first all- electronic desktop calculators .,1
15437,when was washington elected president,"George Washington ( – , 1799) was the first President of the United States (1789–1797), the commander-in-chief of the Continental Army during the American Revolutionary War , and one of the Founding Fathers of the United States .",1
15484,where is the island New Guinea?,"Located in the southwest Pacific Ocean , it lies geographically to the east of the Malay Archipelago , with which it is sometimes included as part of a greater Indo-Australian Archipelago .",1
15546,what is in milk,Milk is a white liquid produced by the mammary glands of mammals .,1
15548,what is in milk,"Early- lactation milk contains colostrum , which carries the mother's antibodies to the baby and can reduce the risk of many diseases in the baby.",1
15559,What is motorcycle speedway racing,"Motorcycle speedway, usually referred to as speedway, is a motorcycle sport involving four and sometimes up to six riders competing over four anti-clockwise laps of an oval circuit.",1
15598,who is the guy in the wheelchair who is smart,"Professor Stephen Hawking , known for being a theoretical physicist , has appeared in many works of popular culture .",1
15604,what is honey bee propolis,Propolis as hive sealing,1
15605,what is honey bee propolis,"Propolis is a resinous mixture that honey bees collect from tree buds, sap flows, or other botanical sources.",1
15611,when was steven tyler born,"Steven Tyler (born Steven Victor Tallarico; March 26, 1948) is an American singer, songwriter, and multi-instrumentalist, best known as the frontman and lead singer of the Boston -based rock band Aerosmith , in which he also plays the harmonica, and occasional piano and percussion.",1
15627,what is blood urea,The liver produces urea in the urea cycle as a waste product of the digestion of protein .,1
15628,what is blood urea,Normal human adult blood should contain between 7 to 21 mg of urea nitrogen per 100 ml (7–21 mg/ dL ) of blood.,1
15646,where are the most concentration of jews living,"According to this report, about 42.5% of all Jews reside in Israel (5.7 million), and 39.3% in the United States (5.3 million), with most of the remainder living in Europe (1.5 million) and Canada (0.4 million).",1
15654,what is corpus christi holiday,"The Feast of Corpus Christi ( Latin for Body of Christ ), also known as Corpus Domini, is a Latin Rite liturgical solemnity celebrating the tradition and belief in the body and blood of Jesus Christ and his Real Presence in the Eucharist .",1
15668,who was the first european in the americas,"The start of the systematic European colonization of the Americas is typically dated to 1492, when a Spanish expedition headed by Christopher Columbus sailed for India to open trade but inadvertently discovered the Americas.",1
15682,where is testosterone produced,"Testosterone is a steroid hormone from the androgen group and is found in mammals, reptiles, birds, and other vertebrates .",1
15683,where is testosterone produced,"In mammals , testosterone is primarily secreted in the testicles of males and the ovaries of females , although small amounts are also secreted by the adrenal glands .",1
15685,where is testosterone produced,"In men, testosterone plays a key role in the development of male reproductive tissues such as the testis and prostate as well as promoting secondary sexual characteristics such as increased muscle , bone mass, and the growth of body hair .",1
15693,what is the difference between multistage and cluster sampling,"Cluster sampling is a sampling technique used when ""natural"" but relatively homogeneous groupings are evident in a statistical population .",1
15700,where is jamestown north carolina,"Jamestown is a town in Guilford County , North Carolina , United States , and is a suburb of the nearby cities of Greensboro and High Point.",1
15714,what is cu the element,Copper is a chemical element with the symbol Cu (from ) and atomic number 29.,1
15759,when was jamestown colonized,"Established by the Virginia Company of London as ""James Fort"" on May 14, 1607 ( O.S. , May 24, 1607 N.S. ), it followed several earlier failed attempts, including the Lost Colony of Roanoke .",1
15784,who is on the $10. bill,"The first U.S. Secretary of the Treasury (1789–95), Alexander Hamilton , is currently featured on the obverse of the bill, while the U.S. Treasury Building is featured on the reverse .",1
15796,when was andy griffith born,"Andy Samuel Griffith (June 1, 1926 – July 3, 2012) was an American actor, television producer, Grammy Award -winning Southern-gospel singer, and writer.",1
15812,who is norah jones parents,She is the daughter of Indian sitar player Ravi Shankar and Sue Jones.,1
15850,what is the capacity of the cowboy stadium,"The stadium seats 85,000, making it the third largest stadium in the NFL by seating capacity .",1
15851,what is the capacity of the cowboy stadium,"The maximum capacity of the stadium, including standing room, is 105,000.",1
15869,what is Carbon 14 dating is a type of ?,"Carbon-14, 14C, or radiocarbon, is a radioactive isotope of carbon with a nucleus containing 6 protons and 8 neutrons .",1
15919,when was the battle at tombstone fought,"The Gunfight at the O.K. Corral was a gunfight that took place at about 3:00 p.m. on Wednesday, October 26, 1881, in Tombstone , Arizona Territory , and is generally regarded as the most famous gunfight in the history of the American Old West .",1
15956,what is the population of algoma wi for 2010,"The population was 3,167 at the 2010 census .",1
15973,what is renaissance english,The English Renaissance was a cultural and artistic movement in England dating from the late 15th and early 16th centuries to the early 17th century.,1
15978,Who is the husband of Betty Ford,"Elizabeth Ann Bloomer Warren ""Betty"" Ford (April 8, 1918 – July 8, 2011), was First Lady of the United States from 1974 to 1977 during the presidency of her husband Gerald Ford .",1
16018,what was Coco Chanel's real first name?,"Gabrielle ""Coco"" Bonheur Chanel (August 19, 1883 – January 10, 1971) was a French fashion designer and founder of the Chanel brand.",1
16029,what is grist mill stone,"A gristmill (also: grist mill, corn mill or flour mill) grinds grain into flour .",1
16090,what is the rule of the 9s,"In adults, the ""rule of nines"" is used to determine the total percentage of area burned for each major section of the body.",1
16098,where  is kj 52 from,"Jonah Kirsten Sorrentino (born June 26, 1975), better known by his stage name KJ-52, is a Christian rapper from Tampa, Florida .",1
16104,what is the sign for degrees,"The degree symbol (°) is a typographical symbol that is used, among other things, to represent degrees of arc (e.g. in geographic coordinate systems ), hours (in the medical field), or degrees of temperature .",1
16105,what is the sign for degrees,"The symbol consists of a small raised circle, historically a zero glyph .",1
16116,what is the prognosis of stomach cancer,Prognosis is poor (5-year survival <5 to 15%) because most patients present with advanced disease.,1
16146,what is el mate,"Mate (, ; sometimes also spelled maté), also known as chimarrão () or cimarrón (), is a traditional South American infused drink , particularly in Argentina, Uruguay, Paraguay and the southern states of Brazil and to a lesser degree in south of Chile, the Bolivian Chaco , Syria and Lebanon.",1
16173,what is dave batista doing now,"He won his MMA debut on October 6, 2012, defeating Vince Lucero via TKO in the first round.",1
16174,WHO IS HENRY SAMPSON JR.,"Henry T. Thomas Sampson, Jr. (born in Jackson, Mississippi in 1934) is an African-American inventor.",1
16261,what is the disease osteonecrosis of the jaw?,Osteonecrosis of the jaw (ONJ) is a severe bone disease that affects the maxilla and the mandible .,1
16263,what is the disease osteonecrosis of the jaw?,"Osteonecrosis of the jaws associated with bisphosphonate therapy, required by some cancer treatment regimens, has been identified and defined as a pathological entity since 2003.",1
16279,what is mincemeat made of,"Mincemeat is a mixture of chopped dried fruit , distilled spirits and spices , and sometimes beef suet , beef , or venison .",1
16312,where is hickory located nc,"Hickory is a city in Catawba County , with parts also in Burke County and Caldwell County .",1
16315,what is Polyester in packaging PET,"Polyethylene terephthalate (sometimes written poly(ethylene terephthalate)), commonly abbreviated PET, PETE, or the obsolete PETP or PET-P, is a thermoplastic polymer resin of the polyester family and is used in synthetic fibers ; beverage, food and other liquid containers ; thermoforming applications; and engineering resins often in combination with glass fiber.",1
16328,who are the two senators of louisiana,Its current senators are Democrat Mary Landrieu and Republican David Vitter .,1
16341,who is director jack smight,"Jack Smight (March 9, 1925 - September 1, 2003) was an American theatre and film director .",1
16346,what is dmitri mendeleev 4,Dmitri Ivanovich Mendeleev (; 8 February 1834 – 2 February 1907 O.S. 27 January 1834 – 20 January 1907) was a Russian chemist and inventor.,1
16347,what is dmitri mendeleev 4,"He formulated the Periodic Law, created his own version of the periodic table of elements , and used it to correct the properties of some already discovered elements and also to predict the properties of elements yet to be discovered!",1
16348,where is modesto california,"Modesto ( Spanish for ""modest""), officially the City of Modesto, is the county seat and largest city of Stanislaus County , California , United States .",1
16366,what is the female symbol called,"The two standard gender symbols denoting male ♂ and female ♀ are derived from astrological symbols , denoting the classical planets Mars and Venus , respectively.",1
16369,what is leasehold; real estate,A leasehold estate is an ownership of a temporary right to hold land or property in which a lessee or a tenant holds rights of real property by some form of title from a lessor or landlord .,1
16455,WHAT IS THE LENGTH OF A NAUTICAL MILE,"By international agreement it has been set at 1,852 metres exactly (about 6,076 feet).",1
16478,what is black hairy tongue disease,"Black hairy tongue (BHT, also termed lingua villosa nigra) refers to a condition of the tongue where the filiform papillae elongate with black or brown discoloration, giving a black and hairy appearance.",1
16482,what is firewire used for,The IEEE 1394 interface is a serial bus interface standard for high-speed communications and isochronous real-time data transfer.,1
16491,when was srv born,"Stephen ""Stevie"" Ray Vaughan (October 3, 1954 – August 27, 1990) was an American guitarist, singer-songwriter, and record producer.",1
16514,what is ethernet gigabit,"In computer networking , gigabit Ethernet (GbE or 1 GigE) is a term describing various technologies for transmitting Ethernet frames at a rate of a gigabit per second (1,000,000,000 bits per second), as defined by the IEEE 802.3-2008 standard.",1
16560,what is tofu made of,"Tofu, also called bean curd, is a food made by coagulating soy juice and then pressing the resulting curds into soft white blocks.",1
16580,Where is Bubbles the Chimp now,"When the trainer shut down his operation in 2004, Bubbles was moved to the Center for Great Apes , a sanctuary in Wauchula, Florida , where he has lived since 2005.",1
16582,what is muse's lead singer's name,"The band consists of school friends Matthew Bellamy (lead vocals, lead guitar, piano, keyboards, keytar ), Christopher Wolstenholme (bass, vocals, keyboards, rhythm guitar, harmonica) and Dominic Howard (drums, percussion, synthesisers, sampling).",1
16592,where is bloemfontein in africa,"Bloemfontein (, ; Dutch for ""fountain of flowers"") is the capital city of the Free State Province of South Africa ; and, as the judicial capital of the nation, one of South Africa's three national capitals – the other two being Cape Town , the legislative capital, and Pretoria , the administrative capital.",1
16638,what is in the preamble of the constitution,The Preamble to the United States Constitution is a brief introductory statement of the Constitution's fundamental purposes and guiding principles.,1
16641,when was the internet started,The history of the Internet began with the development of electronic computers in the 1950s.,1
16666,where is rolling rock brewed,"The brand was sold to Anheuser-Busch of St. Louis, Missouri , in mid 2006, which transferred brewing operations to New Jersey.",1
