,Question,Answer,Label
5616,what does xylem transport,"Its basic function is to transport water, but it also transports some nutrients through the plant.",1
5632,what do jehovah witnesses believe,"Jehovah's Witnesses' beliefs are based on their interpretations of the Bible and they prefer to use their own translation, the New World Translation of the Holy Scriptures .",1
5633,what do jehovah witnesses believe,"They believe that the destruction of the present world system at Armageddon is imminent, and that the establishment of God's kingdom on earth is the only solution for all problems faced by mankind.",1
5660,how old old is xp operating system,"Windows XP was released worldwide for retail sale on October 25, 2001, and over 400 million copies were in use in January 2006.",1
5699,how many pawns in chess,"In chess, each player begins the game with eight pawns, one on each square of the rank immediately in front of the other pieces.",1
5706,what countries allow gays to openly serve in the military,"Nations that permit gay people to serve openly in the military include the 4 of the 5 members of the UN Security Council (United States, United Kingdom, France, and Russia), the Republic of China (Taiwan), Australia , Israel , South Africa , Argentina , and all NATO members excluding Turkey .",1
5708,how is hydrogen produced,Currently the dominant technology for direct production is steam reforming from hydrocarbons .,1
5717,how many percent is a basis point,1 basis point = 1 permyriad = one one-hundredth percent,1
5718,how many percent is a basis point,1 bp = 1 = 0.01% = 0.1‰ = 10−4 = = 0.0001,1
5732,how many percent is a basis point,"The relationship between percentage changes and basis points can be summarized as follows: 1 percentage point change = 100 basis points, and 0.01 percentage points = 1 basis point.",1
5777,what genre is bloody beetroots,"The Bloody Beetroots is the pseudonym of Sir Bob Cornelius Rifo, the Italian electro house and dance-punk music producer , DJ and photographer .",1
5881,what country is madrid spain in,"Madrid (, ) is the capital and largest city of Spain .",1
5912,What causes rogue waves,"Rogue waves seem not to have a single distinct cause, but occur where physical factors such as high winds and strong currents cause waves to merge to create a single exceptionally large wave.",1
5922,what happened to montgomery clift,"Later, after a disfiguring car crash in 1956, and alcohol and prescription drug abuse, he became erratic.",1
5934,what caused the world war 2,"The main causes of World War II were nationalistic issues, unresolved issues, and resentments resulting from World War I and the interwar period in Europe, in addition to the effects of the Great Depression in the 1930s.",1
5935,what caused the world war 2,The culmination of events that led to the outbreak of war are generally understood to be the 1939 invasion of Poland by Germany and Soviet Russia and the 1937 invasion of the Republic of China by the Empire of Japan .,1
5972,how many people die from myasthenia gravis per year,The disease incidence is 3–30 cases per million per year and rising as a result of increased awareness.,1
5999,how many rooms in borgata hotel,"The $1.1 billion casino hotel features 2,002 rooms and is the largest hotel in New Jersey .",1
6031,what country has the most muslims in the world,"The largest Muslim country is Indonesia , home to 12.7% of the world's Muslims, followed by Pakistan (11.0%), India (10.9%), and Bangladesh (9.2%).",1
6043,what country is dubai in,"Dubai ( ; ', ) is a city in the United Arab Emirates , located within the emirate of the same name.",1
6071,how much of earth is covered ocean water,"Approximately 72% of the planet's surface (~3.6x108 km2) is covered by saline water that is customarily divided into several principal oceans and smaller seas, with the ocean covering approximately 71% of the Earth's surface.",1
6109,how is root beer made?,"Root beer is a carbonated , sweetened beverage , originally made using the root of a sassafras plant (or the bark of a sassafras tree) as the primary flavor.",1
6121,what does informal logic mean,"Informal logic, intuitively, refers to the principles of logic and logical thought outside of a formal setting.",1
6148,what country is turkey in,"Turkey (), officially the Republic of Turkey , is a transcontinental country , located mostly on Anatolia in Western Asia and on East Thrace in Southeastern Europe .",1
6149,what country is turkey in,"Turkey is bordered by eight countries: Bulgaria to the northwest; Greece to the west; Georgia to the northeast; Armenia , Iran and the Azerbaijani exclave of Nakhchivan to the east; and Iraq and Syria to the southeast.",1
6185,"what county is Augusta,GA located in?","Augusta is the principal city of the Augusta – Richmond County Metropolitan Statistical Area , which as of 2010 had an estimated population of 556,877, making it both the second-largest city and the second-largest metro area in the state after Atlanta .",1
6245,how many albums has eminem sold in his career,"He has sold more than 100 million records worldwide, including 42 million tracks and 49.1 million albums in the United States.",1
6294,what do pigs eat,Pigs are omnivores and are highly social and intelligent animals.,1
6304,what does a cutter do,"In baseball , a cutter, or cut fastball, is a type of fastball which breaks slightly toward the pitcher 's glove side as it reaches home plate .",1
6311,what it takes aerosmith album,What It Takes is a power ballad by American hard rock band Aerosmith .,1
6313,what it takes aerosmith album,It was released in 1990 as the third single from Aerosmith's critically and commercially successful 1989 album Pump .,1
6323,what county is erie colorado,Erie is a Statutory Town in Boulder and Weld counties in the U.S. state of Colorado .,1
6354,what classes are considered humanities,"The humanities are academic disciplines that study human culture, using methods that are primarily analytical , critical , or speculative , and having a significant historical element, as distinguished from the mainly empirical approaches of the natural sciences .",1
6355,what classes are considered humanities,"The humanities include ancient and modern languages , literature , philosophy , religion , and visual and performing arts such as music and theatre .",1
6356,what classes are considered humanities,"The humanities that are also regarded as social sciences include history , anthropology , area studies , communication studies , cultural studies , law , economics and linguistics .",1
6360,what classes are considered humanities,"Human disciplines like history , cultural anthropology and psychoanalysis study subject matters to which the experimental method does not apply, and they have access instead to the comparative method and comparative research .",1
6364,what does the president of the usa do,The President of the United States of America (POTUS) is the head of state and head of government of the United States .,1
6365,what does the president of the usa do,The president leads the executive branch of the federal government and is the commander-in-chief of the United States Armed Forces .,1
6367,what does the president of the usa do,"The president is further empowered to grant federal pardons and reprieves , and to convene and adjourn either or both houses of Congress under extraordinary circumstances.",1
6434,how many seasons of grey's anatomy are there,"On May 11, 2012, the series was renewed for a ninth season, which premiered on September 27, 2012.",1
6438,how is schizophrenia diagnosed?,Diagnosis is based on observed behavior and the patient's reported experiences.,1
6512,what kind of cut is tri tip,The tri-tip is a cut of beef from the bottom sirloin primal cut .,1
6513,what kind of cut is tri tip,"It is a small triangular muscle , usually 1.5 to 2.5 lbs. (675 to 1,150g) per side of beef.",1
6515,what county is willmar mn in?,"Willmar is a city in, and the county seat of, Kandiyohi County , Minnesota , United States .",1
6560,how does weather happen,Weather is driven by air pressure (temperature and moisture) differences between one place and another.,1
6583,how many countries have english as an official language,"In 2012, there were 88 states in total (60 sovereign states and 28 non-sovereign states).",1
6606,what countries are in cono sur,"Although geographically this includes Southern and part of Southeast ( São Paulo ) of Brazil , in terms of political geography the Southern cone has traditionally comprised Argentina , Chile , Paraguay , and Uruguay .",1
6607,what countries are in cono sur,"In the narrowest sense, it only covers Argentina , Chile and Uruguay , bounded on the north by the states of Brazil, Paraguay, Bolivia and Peru, on the west by the Pacific Ocean, and south to the junction between the Pacific and Atlantic Oceans, which it is the closest continental area of Antarctica (1000 km).",1
6618,how many innings makes an official game,"Since most professional baseball games are nine innings long, the fifth inning is used as the threshold for an official game.",1
6674,what branch of the military is delta force,It was formerly listed as the Combat Applications Group by the Department of Defense but has since been officially re-designated the Army Compartmented Elements (ACE).,1
6750,what causes the seasons,Seasons result from the yearly revolution of the Earth around the Sun and the tilt of the Earth's axis relative to the plane of revolution.,1
6781,what does 3g network mean,"3G, short for third Generation, is the third generation of mobile telecommunications technology.",1
6791,what does Mazel tov! mean,good luck) is a phrase used to express congratulations for a happy and significant occasion or event.,1
6795,How Do You Get Hepatitis C,"HCV is spread primarily by blood-to-blood contact associated with intravenous drug use , poorly sterilized medical equipment and transfusions .",1
6806,how does flexible spending account work,"An FSA allows an employee to set aside a portion of earnings to pay for qualified expenses as established in the cafeteria plan, most commonly for medical expenses but often for dependent care or other expenses.",1
6822,how tennessee became a state,"Tennessee was the last state to leave the Union and join the Confederacy at the outbreak of the U.S. Civil War in 1861, and the first state to be readmitted to the Union at the end of the war.",1
6846,how many baseball teams usa,It is composed of 30 teams — 29 in the United States and one in Canada.,1
6861,how does Delaware support its claim to being the first state?,"Delaware was one of the 13 colonies participating in the American Revolution and on December 7, 1787, became the first state to ratify the Constitution of the United States , thereby becoming known as The First State.",1
6894,how many amendments in the US constitution,"Twenty-seven amendments have been ratified since the original signing of the Constitution, the first ten of which are known collectively as the Bill of Rights .",1
6905,what does fidelity do,"Fidelity Investments manages a large family of mutual funds , provides fund distribution and investment advice services, as well as providing discount brokerage services , retirement services, wealth management , securities execution and clearance, life insurance and a number of other services.",1
6919,what causes thunder sound,Thunder is the sound caused by lightning .,1
6922,what causes thunder sound,"In turn, this expansion of air creates a sonic shock wave, similar to a sonic boom , which produces the sound of thunder, often referred to as a clap, crack, or peal of thunder.",1
6952,what day is the federal holiday for Martin Luther King Jr.,"It is observed on the third Monday of January each year, which is around the time of King's birthday, January 15.",1
7017,what area code is 810,Area code 810 is the telephone area code serving eastern Michigan .,1
7029,how many babies are in a typical raccoon litter,"After a gestation period of about 65 days, two to five young, known as ""kits"", are born in spring.",1
7033,what kind of earthquake was haiti,"The 2010 Haiti earthquake was a catastrophic magnitude 7.0 Mw earthquake , with an epicenter near the town of Léogâne ( Ouest Department ), approximately west of Port-au-Prince , Haiti's capital.",1
7052,what kind of horse was mr ed,"The stars of the show were Mister Ed, a palomino horse who could ""talk"", played by gelding Bamboo Harvester and voiced by former Western star Allan Lane (who went uncredited for the entire length of the series), and his owner, an eccentric and enormously klutzy , yet friendly, architect named Wilbur Post ( Alan Young ).",1
7062,What does Rapture meaning in a theological sense?,"The Rapture is a term in Christian eschatology which refers to the ""being caught up"" discussed in 1 Thessalonians 4:17, when the ""dead in Christ"" and ""we who are alive and remain"" will be ""caught up in the clouds"" to meet ""the Lord in the air"".",1
7072,who does chris humphries play for,"Kris Nathan Humphries (born February 6, 1985) is an American professional basketball player with the Brooklyn Nets .",1
7087,what are corporation balance,"A balance sheet is often described as a ""snapshot of a company's financial condition"".",1
7101,what is .17 hmr caliber,".17 Hornady Magnum Rimfire, commonly known as the .17 HMR, is a rimfire rifle cartridge developed by the ammunition company Hornady in 2002.",1
7159,what made the civil war different from others,"It remains the deadliest war in American history , resulting in the deaths of an estimated 750,000 soldiers and an undetermined number of civilian casualties.",1
7166,where to buy potato bread made without wheat,"It is available as a commercial product in many countries, with similar variations in ingredients, cooking method, and other variables.",1
7179,what year was the 8 track invented,"Stereo 8 was created in 1964 by a consortium led by Bill Lear of Lear Jet Corporation, along with Ampex , Ford Motor Company , General Motors , Motorola , and RCA Victor Records (RCA).",1
7221,who killed julius caesar,"But the underlying political conflicts had not been resolved, and on the Ides of March (15 March) 44 BC, Caesar was assassinated by a group of senators led by Marcus Junius Brutus .",1
7231,what are  the  official languages of nigeria,"The official language of Nigeria, English , the former colonial language, was chosen to facilitate the cultural and linguistic unity of the country.",1
7258,"who played guitar on the kiss album, creatures of the night","It is also the band's last album recorded with Ace Frehley credited as an official member (until 1998's Psycho Circus ), and its first album with Vinnie Vincent as the initially uncredited lead guitarist (Vincent would later be credited, but not featured pictorially on the cover, of 1985's reissue of the album ).",1
7284,who wrote white christmas,White Christmas is an Irving Berlin song reminiscing about an old-fashioned Christmas setting .,1
7292,what are the different types of cross country skiing,"Cross-country skiing is part of the Nordic skiing sport family, which includes ski jumping , Nordic combined (cross-country skiing and ski jumping), Biathlon (skiing and rifle marksmanship ) and ski-orienteering (which includes map navigation along snow trails and tracks).",1
7295,what are use taxes?,"A use tax in United States is complementary to sales tax which means, if you buy a Taxable product/services without paying any Sales tax to vendor, you owe use tax.",1
7303,what are use taxes?,"Use tax is also termed as ""Consumption Tax"" or ""Consumer Use Tax"".",1
7304,what are use taxes?,A use tax is a type of excise tax levied in the United States by numerous state governments.,1
7326,who pulmonary hypertension,It was first identified by Dr. Ernst von Romberg in 1891.,1
7337,what is an array in programming,"In computer science , array programming languages (also known as vector or multidimensional languages) generalize operations on scalars to apply transparently to vectors , matrices , and higher dimensional arrays.",1
7338,what is an array in programming,Array programming primitives concisely express broad ideas about data manipulation.,1
7385,when did the cold war start,"The Cold War, often dated from 1947 to 1991, was a sustained state of political and military tension between powers in the Western Bloc , dominated by the United States with NATO among its allies, and powers in the Eastern Bloc , dominated by the Soviet Union along with the Warsaw Pact .",1
7403,what state is pike's peak in?,"Pikes Peak State Park is a state park of Iowa , USA, featuring a bluff overlooking the Upper Mississippi River opposite the confluence of the Wisconsin River .",1
7445,what state is jakarta in?,"Jakarta (), officially known as the Special Capital Region of Jakarta (), is the capital and largest city of Indonesia .",1
7463,what song is sung in 6 foot 7 foot,"6 Foot 7 Foot (also styled as ""6'7"") is a song by American rapper Lil Wayne featuring label mate, Cory Gunz .",1
7487,what is a book index,An index (plural: indexes) is a list of words or phrases ('headings') and associated pointers ('locators') to where useful material relating to that heading can be found in a document.,1
7492,who can file suspicious activity report,"In United States financial regulation , a suspicious activity report (or SAR) is a report made by a financial institution to the Financial Crimes Enforcement Network (FinCEN), an agency of the United States Department of the Treasury , regarding suspicious or potentially suspicious activity.",1
7495,who created facebook,"It was founded in February 2004 by Mark Zuckerberg with his college roommates and fellow Harvard University students Eduardo Saverin , Andrew McCollum , Dustin Moskovitz and Chris Hughes .",1
7516,what are the sulfas,The original antibacterial sulfonamides (sometimes called sulfa drugs or sulpha drugs) are synthetic antimicrobial agents that contain the sulfonamide group.,1
7536,who owns joe's crab shack,Joe's Crab Shack is an American chain of beach-themed seafood casual dining restaurants owned by Ignite Restaurant Group .,1
7541,where do cruises dock in new york city,New York City Cruise Liner Terminal in Hell's Kitchen at 52nd Street .,1
7570,what is a right wing christian,Christian right is a term used in the United States to describe right-wing Christian political groups that are characterized by their strong support of socially conservative policies.,1
7583,what type of batteries are 357 (LR44),"LR44 is the IEC designation for an alkaline 1.5 volt button cell , commonly used in small LED flashlights , digital thermometers , calculators , calipers , watches , clocks , toys and laser pointers .",1
7613,where did hurricane katrina begin,Hurricane Katrina was the deadliest and most destructive Atlantic hurricane of the 2005 Atlantic hurricane season .,1
7617,where did hurricane katrina begin,"Hurricane Katrina formed over the Bahamas on August 23, 2005 and crossed southern Florida as a moderate Category 1 hurricane , causing some deaths and flooding there before strengthening rapidly in the Gulf of Mexico .",1
7649,what is an assist in basketball,"In basketball , an assist is attributed to a player who passes the ball to a teammate in a way that leads to a score by field goal , meaning that he or she was ""assisting"" in the basket.",1
7662,what is 1 mil guaranies in united states dollars,"The mill or mille () (sometimes mil in the UK , when discussing property taxes in the United States , or previously in Cyprus and Malta ) is a now-abstract unit of currency used sometimes in accounting .",1
7667,where did the persian war take place,The Greco-Persian Wars (also often called the Persian Wars) were a series of conflicts between the Achaemenid Empire of Persia and city-states of the Hellenic world that started in 499 BC and lasted until 449 BC.,1
7676,where did the persian war take place,"In 494 BC, the Persians regrouped, and attacked the epicentre of the revolt in Miletus.",1
7677,where did the persian war take place,"At the Battle of Lade , the Ionians suffered a decisive defeat, and the rebellion collapsed, with the final members being stamped out the following year.",1
7678,where did the persian war take place,"Seeking to secure his empire from further revolts and from the interference of the mainland Greeks, Darius embarked on a scheme to conquer Greece and to punish Athens and Eretria for burning Sardis.",1
7689,where did the persian war take place,"The actions of the general Pausanias at the siege of Byzantium alienated many of the Greek states from the Spartans, and the anti-Persian alliance was therefore reconstituted around Athenian leadership, as the so-called Delian League .",1
7691,where did the persian war take place,"At the Battle of the Eurymedon in 466 BC, the League won a double victory that finally secured freedom for the cities of Ionia.",1
7693,where did the persian war take place,"A fleet was sent to Cyprus in 451 BC, but achieved little, and when it withdrew the Greco-Persian Wars drew to a quiet end.",1
7717,when did thomson make the plum-pudding model,"The plum pudding model of the atom by J. J. Thomson , who discovered the electron in 1897, was proposed in 1904 before the discovery of the atomic nucleus in order to add the electron to the atomic model.",1
7746,what part of the pig is bacon,"It is usually made from side and back cuts of pork, except in the United States, where it is almost always prepared from pork belly (typically referred to as ""streaky"", ""fatty"", or ""American style"" outside of the US and Canada).",1
7766,where did erisa come from,"The Employee Retirement Income Security Act of 1974 (ERISA) (, codified in part at ) is a federal law which establishes minimum standards for pension plans in private industry and provides for extensive rules on the federal income tax effects of transactions associated with employee benefit plans.",1
7767,where did erisa come from,ERISA was enacted to protect the interests of employee benefit plan participants and their beneficiaries by:,1
7778,what percent of illegal immigrants are from mexico and europe,"According to a 2005 Pew Hispanic Center report, 56% of undocumented immigrants were from Mexico ; 22% were from other Latin American countries; 13% were from Asia; 6% were from Europe and Canada; and 3% were from Africa and the rest of the world.",1
7779,what school district is alvin in?,"Alvin Independent School District is a school district based in Alvin , Texas ( USA ).",1
7792,what are the houses of hogwarts,"Hogwarts School of Witchcraft and Wizardry, shortened Hogwarts, is a fictional British school of magic for students aged eleven to eighteen, and is the primary setting for the first six books in J.K. Rowling 's Harry Potter series.",1
7796,when us subprime mortgage market collapse,The U.S. subprime mortgage crisis was a set of events and conditions that led to a financial crisis and subsequent recession that began in 2008.,1
7818,What kind of personality test is the MBTI,The Myers-Briggs Type Indicator (MBTI) assessment is a psychometric questionnaire designed to measure psychological preferences in how people perceive the world and make decisions.,1
7825,What kind of personality test is the MBTI,The MBTI focuses on normal populations and emphasizes the value of naturally occurring differences.,1
7826,What kind of personality test is the MBTI,"Robert Kaplan and Dennis Saccuzzo believe ""the underlying assumption of the MBTI is that we all have specific preferences in the way we construe our experiences, and these preferences underlie our interests, needs, values, and motivation"" (p. 499).",1
7857,what type of game is heavy rain,Heavy Rain is an interactive drama action-adventure video game created by French developer Quantic Dream exclusively for the PlayStation 3 .,1
7873,what are superannuation contributions?,Superannuation in Australia refers to the arrangements which people make in Australia to have funds available for them in retirement .,1
7883,when does the electoral college votes,The United States Electoral College is the institution that officially elects the President and Vice President of the United States every four years.,1
7900,when barack obama was born,"Barack Hussein Obama II (; born August 4, 1961) is the 44th and current President of the United States , the first African American to hold the office.",1
7926,who wrote rhythm of the ancient mariner,"The Rime of the Ancient Mariner (originally The Rime of the Ancyent Marinere) is the longest major poem by the English poet Samuel Taylor Coleridge , written in 1797–98 and published in 1798 in the first edition of Lyrical Ballads .",1
7929,what is a .PAC file,A proxy auto-config (PAC) file defines how web browsers and other user agents can automatically choose the appropriate proxy server (access method) for fetching a given URL .,1
7930,what is a .PAC file,"A PAC file contains a JavaScript function “FindProxyForURL(url, host)”.",1
7973,what are spoilers for,Some spoilers are added to cars primarily for styling purposes and have either little aerodynamic benefit or even make the aerodynamics worse.,1
7982,who sings i am a man of constant sorrow,"Man of Constant Sorrow (also known as ""I Am A Man of Constant Sorrow"") is a traditional American folk song first recorded by Dick Burnett , a partially blind fiddler from Kentucky .",1
7993,who kill franz ferdinand ww1,"On 28 June 1914, Archduke Franz Ferdinand of Austria , heir presumptive to the Austro-Hungarian throne, and his wife, Sophie, Duchess of Hohenberg , were shot dead in Sarajevo , by Gavrilo Princip , one of a group of six Bosnian Serb assassins coordinated by Danilo Ilić .",1
8043,what year did disney's animal kingdom lodge open,"It opened on April 16, 2001.",1
